{
  "schema": "command-sqf-structural-ast",
  "version": 1,
  "executable": false,
  "syntaxOnly": true,
  "offsetEncoding": "utf16-code-units",
  "requiredReview": [
    "expression-types-and-effects",
    "variable-scopes-and-bindings",
    "scheduling-and-locality",
    "native-adapter-semantics",
    "control-flow-lowering"
  ],
  "files": [
    {
      "name": "nested.sqf",
      "textBytes": 706,
      "textLength": 704,
      "tokenCount": 287,
      "sha256": "62c296cc1ff6bcf831a139cfa1fb745cb7e891eef8a58f5b19269f19223a2c40",
      "hashScope": "decoded-utf8-text",
      "mode": "structural-ast",
      "rootId": "node-0"
    }
  ],
  "nodes": [
    {
      "id": "node-0",
      "kind": "Program",
      "source": {
        "file": "nested.sqf",
        "line": 1,
        "column": 1,
        "start": 0,
        "end": 704
      },
      "preview": "_fn={ if (_ready) then { for \"_i\" from 0 to 3 do { if (_i==2) exitWith {hint \"stop\";}; }; } else {while {alive _u} do {sleep 1;};}; {_x doMove [1,2,3];} forEach",
      "parts": [],
      "children": [
        {
          "role": "statement",
          "nodeId": "node-1"
        },
        {
          "role": "statement",
          "nodeId": "node-19"
        },
        {
          "role": "statement",
          "nodeId": "node-25"
        },
        {
          "role": "statement",
          "nodeId": "node-26"
        },
        {
          "role": "statement",
          "nodeId": "node-27"
        },
        {
          "role": "statement",
          "nodeId": "node-28"
        },
        {
          "role": "statement",
          "nodeId": "node-29"
        },
        {
          "role": "statement",
          "nodeId": "node-30"
        },
        {
          "role": "statement",
          "nodeId": "node-31"
        },
        {
          "role": "statement",
          "nodeId": "node-32"
        },
        {
          "role": "statement",
          "nodeId": "node-33"
        },
        {
          "role": "statement",
          "nodeId": "node-34"
        },
        {
          "role": "statement",
          "nodeId": "node-35"
        },
        {
          "role": "statement",
          "nodeId": "node-36"
        },
        {
          "role": "statement",
          "nodeId": "node-37"
        },
        {
          "role": "statement",
          "nodeId": "node-38"
        },
        {
          "role": "statement",
          "nodeId": "node-39"
        },
        {
          "role": "statement",
          "nodeId": "node-40"
        },
        {
          "role": "statement",
          "nodeId": "node-41"
        },
        {
          "role": "statement",
          "nodeId": "node-42"
        },
        {
          "role": "statement",
          "nodeId": "node-43"
        },
        {
          "role": "statement",
          "nodeId": "node-44"
        },
        {
          "role": "statement",
          "nodeId": "node-45"
        },
        {
          "role": "statement",
          "nodeId": "node-46"
        },
        {
          "role": "statement",
          "nodeId": "node-47"
        },
        {
          "role": "statement",
          "nodeId": "node-48"
        },
        {
          "role": "statement",
          "nodeId": "node-49"
        },
        {
          "role": "statement",
          "nodeId": "node-50"
        },
        {
          "role": "statement",
          "nodeId": "node-51"
        },
        {
          "role": "statement",
          "nodeId": "node-52"
        },
        {
          "role": "statement",
          "nodeId": "node-53"
        },
        {
          "role": "statement",
          "nodeId": "node-54"
        },
        {
          "role": "statement",
          "nodeId": "node-55"
        },
        {
          "role": "statement",
          "nodeId": "node-56"
        },
        {
          "role": "statement",
          "nodeId": "node-57"
        },
        {
          "role": "statement",
          "nodeId": "node-58"
        },
        {
          "role": "statement",
          "nodeId": "node-59"
        },
        {
          "role": "statement",
          "nodeId": "node-60"
        },
        {
          "role": "statement",
          "nodeId": "node-61"
        },
        {
          "role": "statement",
          "nodeId": "node-62"
        },
        {
          "role": "statement",
          "nodeId": "node-63"
        },
        {
          "role": "statement",
          "nodeId": "node-64"
        },
        {
          "role": "statement",
          "nodeId": "node-65"
        },
        {
          "role": "statement",
          "nodeId": "node-66"
        },
        {
          "role": "statement",
          "nodeId": "node-67"
        },
        {
          "role": "statement",
          "nodeId": "node-68"
        },
        {
          "role": "statement",
          "nodeId": "node-69"
        },
        {
          "role": "statement",
          "nodeId": "node-70"
        },
        {
          "role": "statement",
          "nodeId": "node-71"
        },
        {
          "role": "statement",
          "nodeId": "node-72"
        },
        {
          "role": "statement",
          "nodeId": "node-73"
        },
        {
          "role": "statement",
          "nodeId": "node-74"
        },
        {
          "role": "statement",
          "nodeId": "node-75"
        }
      ],
      "blockers": [
        "semantic-analysis-required"
      ]
    },
    {
      "id": "node-1",
      "kind": "CodeAssignment",
      "source": {
        "file": "nested.sqf",
        "line": 1,
        "column": 1,
        "start": 0,
        "end": 172
      },
      "preview": "_fn={ if (_ready) then { for \"_i\" from 0 to 3 do { if (_i==2) exitWith {hint \"stop\";}; }; } else {while {alive _u} do {sleep 1;};}; {_x doMove [1,2,3];} forEach",
      "parts": [
        {
          "role": "target",
          "source": {
            "file": "nested.sqf",
            "line": 1,
            "column": 1,
            "start": 0,
            "end": 3
          },
          "preview": "_fn",
          "semanticStatus": "unresolved"
        }
      ],
      "children": [
        {
          "role": "body",
          "nodeId": "node-2"
        }
      ],
      "blockers": [
        "semantic-analysis-required",
        "code-value-execution-unresolved"
      ]
    },
    {
      "id": "node-2",
      "kind": "Block",
      "source": {
        "file": "nested.sqf",
        "line": 1,
        "column": 5,
        "start": 4,
        "end": 172
      },
      "preview": "{ if (_ready) then { for \"_i\" from 0 to 3 do { if (_i==2) exitWith {hint \"stop\";}; }; } else {while {alive _u} do {sleep 1;};}; {_x doMove [1,2,3];} forEach uni",
      "parts": [],
      "children": [
        {
          "role": "statement",
          "nodeId": "node-3"
        },
        {
          "role": "statement",
          "nodeId": "node-16"
        }
      ],
      "blockers": [
        "semantic-analysis-required"
      ]
    },
    {
      "id": "node-3",
      "kind": "If",
      "source": {
        "file": "nested.sqf",
        "line": 1,
        "column": 7,
        "start": 6,
        "end": 130
      },
      "preview": "if (_ready) then { for \"_i\" from 0 to 3 do { if (_i==2) exitWith {hint \"stop\";}; }; } else {while {alive _u} do {sleep 1;};}",
      "parts": [
        {
          "role": "condition",
          "source": {
            "file": "nested.sqf",
            "line": 1,
            "column": 10,
            "start": 9,
            "end": 17
          },
          "preview": "(_ready)",
          "semanticStatus": "unresolved"
        }
      ],
      "children": [
        {
          "role": "then",
          "nodeId": "node-4"
        },
        {
          "role": "else",
          "nodeId": "node-10"
        }
      ],
      "blockers": [
        "semantic-analysis-required"
      ]
    },
    {
      "id": "node-4",
      "kind": "Block",
      "source": {
        "file": "nested.sqf",
        "line": 1,
        "column": 24,
        "start": 23,
        "end": 91
      },
      "preview": "{ for \"_i\" from 0 to 3 do { if (_i==2) exitWith {hint \"stop\";}; }; }",
      "parts": [],
      "children": [
        {
          "role": "statement",
          "nodeId": "node-5"
        }
      ],
      "blockers": [
        "semantic-analysis-required"
      ]
    },
    {
      "id": "node-5",
      "kind": "ForRange",
      "source": {
        "file": "nested.sqf",
        "line": 1,
        "column": 26,
        "start": 25,
        "end": 88
      },
      "preview": "for \"_i\" from 0 to 3 do { if (_i==2) exitWith {hint \"stop\";}; }",
      "parts": [
        {
          "role": "counter",
          "source": {
            "file": "nested.sqf",
            "line": 1,
            "column": 30,
            "start": 29,
            "end": 33
          },
          "preview": "\"_i\"",
          "semanticStatus": "unresolved"
        },
        {
          "role": "from",
          "source": {
            "file": "nested.sqf",
            "line": 1,
            "column": 40,
            "start": 39,
            "end": 40
          },
          "preview": "0",
          "semanticStatus": "unresolved"
        },
        {
          "role": "to",
          "source": {
            "file": "nested.sqf",
            "line": 1,
            "column": 45,
            "start": 44,
            "end": 45
          },
          "preview": "3",
          "semanticStatus": "unresolved"
        }
      ],
      "children": [
        {
          "role": "body",
          "nodeId": "node-6"
        }
      ],
      "blockers": [
        "semantic-analysis-required",
        "loop-runtime-semantics-unresolved"
      ]
    },
    {
      "id": "node-6",
      "kind": "Block",
      "source": {
        "file": "nested.sqf",
        "line": 1,
        "column": 50,
        "start": 49,
        "end": 88
      },